{
 "aggregate_score": null,
 "authority": {
  "can_decide": false,
  "note": "The packet routes preregistered stresses to evidence or judgment review; it never aggregates outcomes or decides swaps."
 },
 "bracket": {
  "source": "grok_estimated_ceiling",
  "suite_family": "B4_resilience",
  "value": 4
 },
 "canonical_hash": "lh1:f26970666b9912491e184ac2c95a8fb5890662378f0c1f8db5feaa30e2a50efd",
 "deck_id": "Nicol_Bolas",
 "evidence_class": "derived_metric",
 "items": [
  {
   "decision_authority": false,
   "evidence": {
    "evidence_class": "test_result",
    "legacy_preregistered": {
     "metric": "mana_available_t8",
     "registered": "2026-10-16 (Bot cycle 57.4, before any stress run)",
     "threshold": 0.5
    },
    "legacy_verdict": "pass",
    "primary_result": {
     "baseline": 8.122,
     "challenger": 8.09,
     "ci95": [
      -0.05846,
      -0.00554
     ],
     "diff": -0.032,
     "method": "paired: baseline unperturbed, challenger perturbed, same shuffles; diff per game; CI95 normal",
     "metric": "mana_available_t8"
    },
    "record_id": "test:nicol-bolas:stress:board_wipe:e3bb5d47dd9f",
    "recovery_metrics": [
     {
      "ci95": [
       0.99238,
       1.0
      ],
      "method": "share of perturbed games in which the scripted event happened (e.g. the commander was on the battlefield to be removed)",
      "metric": "event_fired_share",
      "n": 500,
      "value": 1.0
     },
     {
      "ci95": [
       0.79577,
       0.94261
      ],
      "method": "share of games with a commander removal in which the commander was recast by turn 10",
      "metric": "commander_recast_share",
      "n": 72,
      "value": 0.88889
     },
     {
      "ci95": [
       1.96559,
       2.56566
      ],
      "method": "turns from the first removal (end step) to the recast, among games where it was recast",
      "metric": "recovery_turns",
      "n": 64,
      "value": 2.26562
     },
     {
      "ci95": [
       0.4274,
       0.65172
      ],
      "method": "share of removal games where the commander was recast within 2 turns",
      "metric": "recovered_within_2_turns_share",
      "n": 72,
      "value": 0.54167
     }
    ],
    "reuse_note": "Existing M3 paired stress evidence is reused under the Step-F bracket priority; its original preregistration, model and limitations are not rewritten.",
    "scenario": "board_wipe@T5: every nonland creature you control is destroyed at the end of turn T (commanders go to the command zone)",
    "source": "data/grixis/stress/nicol-bolas.json#test:nicol-bolas:stress:board_wipe:e3bb5d47dd9f",
    "status": "reused_existing_test_result"
   },
   "id": "board_wipe",
   "kind": "simulator_scenario",
   "preregistered_executor": "board_wipe",
   "priority_weight": 0.15,
   "question": "Creature-board wipe and rebuilding pressure."
  },
  {
   "decision_authority": false,
   "evidence": {
    "evidence_class": "test_result",
    "legacy_preregistered": {
     "metric": "mana_available_t8",
     "registered": "2026-10-16 (Bot cycle 57.4, before any stress run)",
     "threshold": 0.5
    },
    "legacy_verdict": "fail",
    "primary_result": {
     "baseline": 8.122,
     "challenger": 6.49,
     "ci95": [
      -1.75511,
      -1.50889
     ],
     "diff": -1.632,
     "method": "paired: baseline unperturbed, challenger perturbed, same shuffles; diff per game; CI95 normal",
     "metric": "mana_available_t8"
    },
    "record_id": "test:nicol-bolas:stress:artifacts_wiped:bdfbfe86ce8d",
    "recovery_metrics": [
     {
      "ci95": [
       0.99238,
       1.0
      ],
      "method": "share of perturbed games in which the scripted event happened (e.g. the commander was on the battlefield to be removed)",
      "metric": "event_fired_share",
      "n": 500,
      "value": 1.0
     }
    ],
    "reuse_note": "Existing M3 paired stress evidence is reused under the Step-F bracket priority; its original preregistration, model and limitations are not rewritten.",
    "scenario": "artifacts_wiped@T4: every nonland artifact you control is destroyed at the end of turn T",
    "source": "data/grixis/stress/nicol-bolas.json#test:nicol-bolas:stress:artifacts_wiped:bdfbfe86ce8d",
    "status": "reused_existing_test_result"
   },
   "id": "artifact_wipe",
   "kind": "simulator_scenario",
   "preregistered_executor": "artifacts_wiped",
   "priority_weight": 0.1,
   "question": "Artifact wipe / mana-engine disruption."
  },
  {
   "decision_authority": false,
   "evidence": {
    "evidence_class": "test_result",
    "legacy_preregistered": {
     "metric": "commander_bf_turns",
     "registered": "2026-10-16 (Bot cycle 57.4, before any stress run)",
     "threshold": 1.0
    },
    "legacy_verdict": "fail",
    "primary_result": {
     "baseline": 3.14,
     "challenger": 0.26,
     "ci95": [
      -3.04936,
      -2.71064
     ],
     "diff": -2.88,
     "method": "paired: baseline unperturbed, challenger perturbed, same shuffles; diff per game; CI95 normal",
     "metric": "commander_bf_turns"
    },
    "record_id": "test:nicol-bolas:stress:commander_removed_twice:20996009953d",
    "recovery_metrics": [
     {
      "ci95": [
       0.78605,
       0.85304
      ],
      "method": "share of perturbed games in which the scripted event happened (e.g. the commander was on the battlefield to be removed)",
      "metric": "event_fired_share",
      "n": 500,
      "value": 0.822
     },
     {
      "ci95": [
       0.50641,
       0.60207
      ],
      "method": "share of games with a commander removal in which the commander was recast by turn 10",
      "metric": "commander_recast_share",
      "n": 411,
      "value": 0.55474
     },
     {
      "ci95": [
       1.94947,
       2.2172
      ],
      "method": "turns from the first removal (end step) to the recast, among games where it was recast",
      "metric": "recovery_turns",
      "n": 228,
      "value": 2.08333
     },
     {
      "ci95": [
       0.35756,
       0.45201
      ],
      "method": "share of removal games where the commander was recast within 2 turns",
      "metric": "recovered_within_2_turns_share",
      "n": 411,
      "value": 0.40389
     }
    ],
    "reuse_note": "Existing M3 paired stress evidence is reused under the Step-F bracket priority; its original preregistration, model and limitations are not rewritten.",
    "scenario": "commander_removed_twice@T4: as once, and again at the end of the first turn after the recast that it is back on the battlefield",
    "source": "data/grixis/stress/nicol-bolas.json#test:nicol-bolas:stress:commander_removed_twice:20996009953d",
    "status": "reused_existing_test_result"
   },
   "id": "commander_disruption",
   "kind": "simulator_scenario",
   "preregistered_executor": "commander_removed_twice",
   "priority_weight": 0.15,
   "question": "Repeated commander removal and tax recovery."
  },
  {
   "decision_authority": false,
   "evidence": {
    "evidence_class": "test_result",
    "legacy_preregistered": {
     "metric": "win_turn_proxy_by_t8",
     "registered": "2026-10-16 (Bot cycle 57.4, before any stress run)",
     "threshold": 0.02
    },
    "legacy_verdict": "inconclusive",
    "primary_result": {
     "baseline": 0.05,
     "challenger": 0.032,
     "ci95": [
      -0.02967,
      -0.00633
     ],
     "diff": -0.018,
     "method": "paired: baseline unperturbed, challenger perturbed, same shuffles; diff per game; CI95 normal",
     "metric": "win_turn_proxy_by_t8"
    },
    "record_id": "test:nicol-bolas:stress:key_engine_exiled:e16142ae6368",
    "recovery_metrics": [
     {
      "ci95": [
       0.66668,
       0.74615
      ],
      "method": "share of perturbed games in which the scripted event happened (e.g. the commander was on the battlefield to be removed)",
      "metric": "event_fired_share",
      "n": 500,
      "value": 0.708
     }
    ],
    "reuse_note": "Existing M3 paired stress evidence is reused under the Step-F bracket priority; its original preregistration, model and limitations are not rewritten.",
    "scenario": "key_engine_exiled@T1: the first engine card (combo piece or identity-core card) to reach the battlefield is exiled at the end of that turn",
    "source": "data/grixis/stress/nicol-bolas.json#test:nicol-bolas:stress:key_engine_exiled:e16142ae6368",
    "status": "reused_existing_test_result"
   },
   "id": "key_engine_exiled",
   "kind": "simulator_scenario",
   "preregistered_executor": "key_engine_exiled",
   "priority_weight": 0.1,
   "question": "Central engine removal/exile."
  },
  {
   "decision_authority": false,
   "evidence": {
    "evidence_class": "test_result",
    "legacy_preregistered": {
     "metric": "commander_cast_by_t6",
     "registered": "2026-10-16 (Bot cycle 57.4, before any stress run)",
     "threshold": 0.05
    },
    "legacy_verdict": "fail",
    "primary_result": {
     "baseline": 0.296,
     "challenger": 0.096,
     "ci95": [
      -0.23553,
      -0.16447
     ],
     "diff": -0.2,
     "method": "paired: baseline unperturbed, challenger perturbed, same shuffles; diff per game; CI95 normal",
     "metric": "commander_cast_by_t6"
    },
    "record_id": "test:nicol-bolas:stress:mana_screw:8f6ef957ed17",
    "recovery_metrics": [
     {
      "ci95": [
       0.0,
       0.00762
      ],
      "method": "share of perturbed games in which the scripted event happened (e.g. the commander was on the battlefield to be removed)",
      "metric": "event_fired_share",
      "n": 500,
      "value": 0.0
     }
    ],
    "reuse_note": "Existing M3 paired stress evidence is reused under the Step-F bracket priority; its original preregistration, model and limitations are not rewritten.",
    "scenario": "mana_screw@T3: no land drop on turns T and T+1",
    "source": "data/grixis/stress/nicol-bolas.json#test:nicol-bolas:stress:mana_screw:8f6ef957ed17",
    "status": "reused_existing_test_result"
   },
   "id": "mana_screw",
   "kind": "simulator_scenario",